### ISSUE TITLE
Bandit ceases response mid stream

### ISSUE THREAD

**Issue by ns-blee** [mtrudel/bandit#492]
We are proxying connections. When we set the initial window size (2MB) we are running into the following problem. It appears Bandit is not honoring the window size. It sends ~65.54k (the default) of data truncating at the exact same point then the connection is closed after 15 seconds. 

```
[F][ 0.001] send SETTINGS frame <length=18, flags=0x00, streamid=0>
     (niv=3)
     [SETTINGS_MAX_CONCURRENT_STREAMS(0x03):100]
     [SETTINGS_HEADER_TABLE_SIZE(0x01):4096]
     [SETTINGS_INITIAL_WINDOW_SIZE(0x04):2097152]
```

```
1	0.000000	163.116.194.127	10.122.140.186	TCP	68	34264 → 4010 [SYN] Seq=0 Win=65535 Len=0 MSS=1460 SACK_PERM=1 WS=64
2	0.000040	10.122.140.186	163.116.194.127	TCP	68	4010 → 34264 [SYN, ACK] Seq=0 Ack=1 Win=65535 Len=0 MSS=8960 SACK_PERM=1 WS=128
3	0.000236	163.116.194.127	10.122.140.186	TCP	56	34264 → 4010 [ACK] Seq=1 Ack=1 Win=65536 Len=0
4	0.000329	163.116.194.127	10.122.140.186	TLSv1.3	573	Client Hello
5	0.000341	10.122.140.186	163.116.194.127	TCP	56	4010 → 34264 [ACK] Seq=1 Ack=518 Win=66688 Len=0
6	0.004678	10.122.140.186	163.116.194.127	TLSv1.3	4888	Server Hello, Change Cipher Spec, Application Data, Application Data, Application Data, Application Data
7	0.004850	163.116.194.127	10.122.140.186	TCP	56	34264 → 4010 [ACK] Seq=518 Ack=4381 Win=74304 Len=0
8	0.004864	163.116.194.127	10.122.140.186	TCP	56	34264 → 4010 [ACK] Seq=518 Ack=4833 Win=77248 Len=0
9	0.005283	163.116.194.127	10.122.140.186	TLSv1.3	136	Change Cipher Spec, Application Data
10	0.005288	10.122.140.186	163.116.194.127	TCP	56	4010 → 34264 [ACK] Seq=4833 Ack=598 Win=66688 Len=0
11	0.005373	163.116.194.127	10.122.140.186	TLSv1.3	616	Application Data, Application Data, Application Data, Application Data, Application Data
12	0.005377	10.122.140.186	163.116.194.127	TCP	56	4010 → 34264 [ACK] Seq=4833 Ack=1158 Win=67840 Len=0
13	0.005816	10.122.140.186	163.116.194.127	TLSv1.3	87	Application Data
14	0.005938	10.122.140.186	163.116.194.127	TLSv1.3	87	Application Data
15	0.005941	163.116.194.127	10.122.140.186	TCP	56	34264 → 4010 [ACK] Seq=1158 Ack=4864 Win=77248 Len=0
16	0.005978	163.116.194.127	10.122.140.186	TLSv1.3	87	Application Data
17	0.005983	10.122.140.186	163.116.194.127	TCP	56	4010 → 34264 [ACK] Seq=4895 Ack=1189 Win=67840 Len=0
18	0.006003	10.122.140.186	163.116.194.127	TLSv1.3	87	Application Data
19	0.006025	163.116.194.127	10.122.140.186	TCP	56	34264 → 4010 [ACK] Seq=1189 Ack=4895 Win=77248 Len=0
20	0.006080	163.116.194.127	10.122.140.186	TCP	56	34264 → 4010 [ACK] Seq=1189 Ack=4926 Win=77248 Len=0
21	0.007929	10.122.140.186	163.116.194.127	TLSv1.3	195	Application Data
22	0.008079	163.116.194.127	10.122.140.186	TCP	56	34264 → 4010 [ACK] Seq=1189 Ack=5065 Win=80192 Len=0
23	0.008130	10.122.140.186	163.116.194.127	TCP	7356	4010 → 34264 [PSH, ACK] Seq=5065 Ack=1189 Win=67840 Len=7300 [TCP segment of a reassembled PDU]
24	0.008151	10.122.140.186	163.116.194.127	TCP	7356	4010 → 34264 [PSH, ACK] Seq=12365 Ack=1189 Win=67840 Len=7300 [TCP segment of a reassembled PDU]
25	0.008273	163.116.194.127	10.122.140.186	TCP	56	34264 → 4010 [ACK] Seq=1189 Ack=12365 Win=94784 Len=0
26	0.008281	10.122.140.186	163.116.194.127	TLSv1.3	10276	Application Data [TCP segment of a reassembled PDU]
27	0.008302	163.116.194.127	10.122.140.186	TCP	56	34264 → 4010 [ACK] Seq=1189 Ack=16745 Win=103552 Len=0
28	0.008307	10.122.140.186	163.116.194.127	TLSv1.3	13196	Application Data [TCP segment of a reassembled PDU]
29	0.008325	163.116.194.127	10.122.140.186	TCP	56	34264 → 4010 [ACK] Seq=1189 Ack=19665 Win=109376 Len=0
30	0.008331	10.122.140.186	163.116.194.127	TCP	5896	4010 → 34264 [PSH, ACK] Seq=43025 Ack=1189 Win=67840 Len=5840 [TCP segment of a reassembled PDU]
31	0.008424	163.116.194.127	10.122.140.186	TCP	56	34264 → 4010 [ACK] Seq=1189 Ack=29885 Win=129792 Len=0
32	0.008428	10.122.140.186	163.116.194.127	TLSv1.3	10276	Application Data [TCP segment of a reassembled PDU]
33	0.008446	163.116.194.127	10.122.140.186	TCP	56	34264 → 4010 [ACK] Seq=1189 Ack=40105 Win=150272 Len=0
34	0.008450	10.122.140.186	163.116.194.127	TLSv1.3	11717	Application Data, Application Data
35	0.008468	163.116.194.127	10.122.140.186	TCP	56	34264 → 4010 [ACK] Seq=1189 Ack=43025 Win=156096 Len=0
36	0.008479	163.116.194.127	10.122.140.186	TCP	56	34264 → 4010 [ACK] Seq=1189 Ack=48865 Win=167744 Len=0
37	0.008582	163.116.194.127	10.122.140.186	TCP	56	34264 → 4010 [ACK] Seq=1189 Ack=59085 Win=188224 Len=0
38	0.008606	163.116.194.127	10.122.140.186	TCP	56	34264 → 4010 [ACK] Seq=1189 Ack=69305 Win=208640 Len=0
39	0.008620	163.116.194.127	10.122.140.186	TCP	56	34264 → 4010 [ACK] Seq=1189 Ack=70746 Win=211584 Len=0
40	15.009022	10.122.140.186	163.116.194.127	TLSv1.3	210	Application Data
41	15.009087	10.122.140.186	163.116.194.127	TLSv1.3	814	Application Data
42	15.009209	163.116.194.127	10.122.140.186	TCP	56	34264 → 4010 [ACK] Seq=1189 Ack=70900 Win=214464 Len=0
43	15.009228	163.116.194.127	10.122.140.186	TCP	56	34264 → 4010 [ACK] Seq=1189 Ack=71658 Win=217408 Len=0
44	15.009327	10.122.140.186	163.116.194.127	TLSv1.3	91	Application Data
45	15.009389	163.116.194.127	10.122.140.186	TLSv1.3	91	Application Data
46	15.009409	10.122.140.186	163.116.194.127	TCP	56	4010 → 34264 [ACK] Seq=71693 Ack=1224 Win=67840 Len=0
47	15.009432	163.116.194.127	10.122.140.186	TCP	56	34264 → 4010 [ACK] Seq=1224 Ack=71693 Win=217408 Len=0
48	15.009566	163.116.194.127	10.122.140.186	TCP	56	34264 → 4010 [RST, ACK] Seq=1224 Ack=71693 Win=217408 Len=0
```

**Comment by ns-blee** [comment]
Actually Im getting 

```
14:17:32.858 [error] ** (Bandit.HTTP2.Errors.StreamError) Timeout waiting for space in the send_window
```

**Comment by mtrudel** [comment]
Are you saying that your client sends an initial window size of 2097152 and Bandit isn't honouring that?

**Comment by ns-blee** [comment]
That appears to be the case, yes.

**Comment by ns-blee** [comment]
You can see here the server sends data, the client acks multiple times and after 15 seconds there is a response which corresponds to the above window timeouts 

```
34	0.008450	10.122.140.186	163.116.194.127	TLSv1.3	11717	Application Data, Application Data
35	0.008468	163.116.194.127	10.122.140.186	TCP	56	34264 → 4010 [ACK] Seq=1189 Ack=43025 Win=156096 Len=0
36	0.008479	163.116.194.127	10.122.140.186	TCP	56	34264 → 4010 [ACK] Seq=1189 Ack=48865 Win=167744 Len=0
37	0.008582	163.116.194.127	10.122.140.186	TCP	56	34264 → 4010 [ACK] Seq=1189 Ack=59085 Win=188224 Len=0
38	0.008606	163.116.194.127	10.122.140.186	TCP	56	34264 → 4010 [ACK] Seq=1189 Ack=69305 Win=208640 Len=0
39	0.008620	163.116.194.127	10.122.140.186	TCP	56	34264 → 4010 [ACK] Seq=1189 Ack=70746 Win=211584 Len=0
40	15.009022	10.122.140.186	163.116.194.127	TLSv1.3	210	Application Data
```

**Comment by ns-blee** [comment]
Client side this leads to a time out or `NS_ERROR_NET_PARTIAL_TRANSFER`

**Comment by mtrudel** [comment]
I assume you're using a well tested client here?

**Comment by ns-blee** [comment]
This issue only arises with bandit when passing initial window size. No other traffic is effected.

**Comment by ns-blee** [comment]
Im not sure if this will have any bearing...

```
http_opts = [
  ip: {0, 0, 0, 0},
  port: System.get_env("PORT") || 4010,
  thousand_island_options: [
    num_acceptors: 100,
    num_connections: 100,
    transport_options: [
      buffer: 1_048_576,
      recbuf: 4_194_304,
      sndbuf: 4_194_304,
      nodelay: true,
      delay_send: false,
      priority: 0
    ]
  ]
]
```

**Comment by mtrudel** [comment]
I don't seem to be able to come up with a local repro. FWIW I'm using:

```elixir 
Mix.install([{:bandit, github: "mtrudel/bandit", branch: "492-investigation"}])

Bandit.start_link(
  scheme: :https,
  certfile: "/Users/mat/Code/bandit/test/support/cert.pem",
  keyfile: "/Users/mat/Code/bandit/test/support/key.pem",
  thousand_island_options: [
    num_acceptors: 100,
    num_connections: 100,
    transport_options: [
      buffer: 1_048_576,
      recbuf: 4_194_304,
      sndbuf: 4_194_304,
      nodelay: true,
      delay_send: false,
      priority: 0
    ]
  ],
  plug: fn conn, _ -> 
    Plug.Conn.send_resp(conn, 200, String.duplicate("a", 1000000000))
  end
)

Process.sleep(:infinity)
```

and a client of 

```
nghttp -w 21 -n -y https://localhost:4040
```

and the exchanges look exactly like I'd suspect. 

Would you be able to run the `492-investigation` branch in the scenario where you're seeing this issue and report back with all the lines prefixed with `XXX-492` (there's a non-zero chance that there may be sensitive info if you've got lingering send buffers; feel free to redact as needed but please indicate the number of bytes redacted if so).

**Comment by mtrudel** [comment]
One thing I'll note (but that I don't think makes a difference) is that nghttp's command line -w option does 2^n-1, so it's actually 2097151, not 2097152 as you indicated above. I've tried with -w entries both larger and smaller and everything continues to work as expected, but I suppose it's worth testing considering that there may be some oddball math boundary there (the CLI tool's -w option isn't sufficient to get to that window size exactly).

**Comment by ns-blee** [comment]
With Proxy:
```
XXX-492 recv Settings: %Bandit.HTTP2.Settings{
  header_table_size: 4096,
  max_concurrent_streams: :infinity,
  initial_window_size: 2097152,
  max_frame_size: 16384,
  max_header_list_size: :infinity
}
XXX-492 recv Settings: %Bandit.HTTP2.Settings{
  header_table_size: 65536,
  max_concurrent_streams: :infinity,
  initial_window_size: 65535,
  max_frame_size: 16384,
  max_header_list_size: 262144
}
XXX-492 steam init: {1, 65535}
XXX-492 send data (conn): {1, 65535}
XXX-492 in send data: %Bandit.HTTP2.Stream{
  connection_pid: #PID<0.534.0>,
  stream_id: 1,
  state: :remote_closed,
  recv_window_size: 65535,
  send_window_size: 0,
  bytes_remaining: nil,
  transport_info: %Bandit.TransportInfo{
    secure?: true,
    sockname: {{10, 118, 16, 65}, 4040},
    peername: {{0, 0, 0, 0}, 23880}, // Removed
    peercert: nil
  },
  read_timeout: 15000
}
XXX-492 in send data: 934465

16:08:17.439 [error] ** (Bandit.HTTP2.Errors.StreamError) Timeout waiting for space in the send_window
```

Without Proxy:
```
XXX-492 recv Settings: %Bandit.HTTP2.Settings{
  header_table_size: 65536,
  max_concurrent_streams: :infinity,
  initial_window_size: 6291456,
  max_frame_size: 16384,
  max_header_list_size: 262144
}
XXX-492 steam init: {1, 6291456}
XXX-492 send data (conn): {1, 1000000}
XXX-492 in send data: %Bandit.HTTP2.Stream{
  connection_pid: #PID<0.593.0>,
  stream_id: 1,
  state: :remote_closed,
  recv_window_size: 65535,
  send_window_size: 5291456,
  bytes_remaining: nil,
  transport_info: %Bandit.TransportInfo{
    secure?: true,
    sockname: {{10, 118, 16, 65}, 4040},
    peername: {{0, 0, 0, 0}, 57138}, // Removed
    peercert: nil
  },
  read_timeout: 15000
}
XXX-492 in send data: 0
```

**Comment by ns-blee** [comment]
We are sending 2 SETTINGS frames
```
send SETTINGS frame <length=12, flags=0x00, streamid=0>
     (niv=2)
     [SETTINGS_ENABLE_PUSH(0x02):0]
     [SETTINGS_INITIAL_WINDOW_SIZE(0x04):2097152]
send SETTINGS frame <length=12, flags=0x00, streamid=0>
     (niv=2)
     [SETTINGS_HEADER_TABLE_SIZE(0x01):65536]
     [SETTINGS_MAX_FRAME_SIZE(0x05):16384]
```
It appears that bandit is using defaults when no values are passed instead of maintaining the previous value

According to paragraph 4 https://datatracker.ietf.org/doc/html/rfc7540#section-6.5 this appears incorrect 

```
   Each parameter in a SETTINGS frame replaces any existing value for
   that parameter.  Parameters are processed in the order in which they
   appear, and a receiver of a SETTINGS frame does not need to maintain
   any state other than the current value of its parameters.  Therefore,
   the value of a SETTINGS parameter is the last value that is seen by a
   receiver.
```

**Comment by mtrudel** [comment]
> It appears that bandit is using defaults when no values are passed instead of maintaining the previous value

Yep, that'd explain it. I should be able to get to this over the weekend. Stay tuned.

**Comment by ns-blee** [comment]
Thank you for your expeditiousness!

**Comment by ns-blee** [comment]
@mtrudel  I have updated `lib/bandit/http2/frame/settings.ex` & `lib/bandit/http2/connection.ex` & `lib/bandit/http2/settings.ex` here: https://github.com/ns-blee/bandit and it works as expected, if you'd like to review the code...

**Comment by ns-blee** [comment]
@mtrudel  I have updated lib/bandit/http2/frame/settings.ex & lib/bandit/http2/connection.ex & lib/bandit/http2/settings.ex here: https://github.com/ns-blee/bandit and it works as expected, if you'd like to review the code. Would you like me to create a PR?

**Comment by ns-blee** [comment]
@mtrudel I've tested the PR in production environments with complete success. Hopefully it helps.
